[
  {
    "id": "p001",
    "name": "Ines",
    "bucket": "1990s/south-america",
    "consent": "synthetic",
    "facts": [
      {
        "field": "name",
        "type": "facts",
        "value": "Ines"
      },
      {
        "field": "city",
        "type": "facts",
        "value": "Bogota"
      },
      {
        "field": "decade",
        "type": "facts",
        "value": "1990s"
      },
      {
        "field": "parent1",
        "type": "facts",
        "value": "storm"
      },
      {
        "field": "parent2",
        "type": "facts",
        "value": "protector"
      },
      {
        "field": "school",
        "type": "facts",
        "value": "village"
      },
      {
        "field": "event1",
        "type": "facts",
        "value": "translator"
      },
      {
        "field": "event2",
        "type": "facts",
        "value": "grandparent"
      },
      {
        "field": "event3",
        "type": "facts",
        "value": "seen"
      },
      {
        "field": "event4",
        "type": "facts",
        "value": "none"
      },
      {
        "field": "comfort",
        "type": "preferences",
        "value": "standing between two rooms"
      },
      {
        "field": "way_of_loving",
        "type": "preferences",
        "value": "by protecting"
      },
      {
        "field": "core_fear",
        "type": "fears",
        "value": "the mood changing without warning"
      },
      {
        "field": "social_fear",
        "type": "fears",
        "value": "being the one who left"
      },
      {
        "field": "under_stress",
        "type": "stress",
        "value": "reads doors and footsteps"
      },
      {
        "field": "under_conflict",
        "type": "stress",
        "value": "holds on tighter"
      },
      {
        "field": "fragment_1",
        "type": "fragments",
        "value": "Moods no one named. I became a reader of doors and footsteps. My intuition was born as a survival skill."
      },
      {
        "field": "fragment_2",
        "type": "fragments",
        "value": "Forty-minute ride, same faces for twelve years. Leaving was the plan or the sin."
      },
      {
        "field": "fragment_3",
        "type": "fragments",
        "value": "Between languages, between parents, between worlds. I became the bridge."
      },
      {
        "field": "fragment_4",
        "type": "fragments",
        "value": "One older person who had time. Their kitchen was the safest room in the world."
      }
    ]
  },
  {
    "id": "p002",
    "name": "Jun",
    "bucket": "2000s/south-asia",
    "consent": "synthetic",
    "facts": [
      {
        "field": "name",
        "type": "facts",
        "value": "Jun"
      },
      {
        "field": "city",
        "type": "facts",
        "value": "Chennai"
      },
      {
        "field": "decade",
        "type": "facts",
        "value": "2000s"
      },
      {
        "field": "parent1",
        "type": "facts",
        "value": "provider"
      },
      {
        "field": "parent2",
        "type": "facts",
        "value": "storm"
      },
      {
        "field": "school",
        "type": "facts",
        "value": "public"
      },
      {
        "field": "event1",
        "type": "facts",
        "value": "illness"
      },
      {
        "field": "event2",
        "type": "facts",
        "value": "responsibility"
      },
      {
        "field": "event3",
        "type": "facts",
        "value": "comparison"
      },
      {
        "field": "event4",
        "type": "facts",
        "value": "summer"
      },
      {
        "field": "comfort",
        "type": "preferences",
        "value": "waiting rooms"
      },
      {
        "field": "way_of_loving",
        "type": "preferences",
        "value": "in the calm between weathers"
      },
      {
        "field": "core_fear",
        "type": "fears",
        "value": "being provided for but not seen"
      },
      {
        "field": "social_fear",
        "type": "fears",
        "value": "losing rank at the table"
      },
      {
        "field": "under_stress",
        "type": "stress",
        "value": "gets organized and goes quiet"
      },
      {
        "field": "under_conflict",
        "type": "stress",
        "value": "goes silent and watchful"
      },
      {
        "field": "fragment_1",
        "type": "fragments",
        "value": "Present through rules, money, and silence. Love was structure. I learned that being provided for and being seen are different things."
      },
      {
        "field": "fragment_2",
        "type": "fragments",
        "value": "Buses, tests, a gifted track, and a lunch table that decided my rank."
      },
      {
        "field": "fragment_3",
        "type": "fragments",
        "value": "Mine or theirs. Waiting rooms. Learning that bodies can fail."
      },
      {
        "field": "fragment_4",
        "type": "fragments",
        "value": "I raised a sibling or ran the house before I was twelve."
      }
    ]
  },
  {
    "id": "p003",
    "name": "Zara",
    "bucket": "1990s/north-america",
    "consent": "synthetic",
    "facts": [
      {
        "field": "name",
        "type": "facts",
        "value": "Zara"
      },
      {
        "field": "city",
        "type": "facts",
        "value": "Miami"
      },
      {
        "field": "decade",
        "type": "facts",
        "value": "1990s"
      },
      {
        "field": "parent1",
        "type": "facts",
        "value": "friend"
      },
      {
        "field": "parent2",
        "type": "facts",
        "value": "constant"
      },
      {
        "field": "school",
        "type": "facts",
        "value": "public"
      },
      {
        "field": "event1",
        "type": "facts",
        "value": "humiliation"
      },
      {
        "field": "event2",
        "type": "facts",
        "value": "shamed"
      },
      {
        "field": "event3",
        "type": "facts",
        "value": "grandparent"
      },
      {
        "field": "event4",
        "type": "facts",
        "value": "needed"
      },
      {
        "field": "comfort",
        "type": "preferences",
        "value": "being unseen"
      },
      {
        "field": "way_of_loving",
        "type": "preferences",
        "value": "by staying"
      },
      {
        "field": "core_fear",
        "type": "fears",
        "value": "having no adult in the room"
      },
      {
        "field": "social_fear",
        "type": "fears",
        "value": "losing rank at the table"
      },
      {
        "field": "under_stress",
        "type": "stress",
        "value": "becomes the grown-up in the room"
      },
      {
        "field": "under_conflict",
        "type": "stress",
        "value": "stays and listens"
      },
      {
        "field": "fragment_1",
        "type": "fragments",
        "value": "A parent who never grew up. I heard adult secrets at nine and became the grown-up in the house."
      },
      {
        "field": "fragment_2",
        "type": "fragments",
        "value": "Buses, tests, a gifted track, and a lunch table that decided my rank."
      },
      {
        "field": "fragment_3",
        "type": "fragments",
        "value": "One moment in front of everyone. I decided something about visibility that day."
      },
      {
        "field": "fragment_4",
        "type": "fragments",
        "value": "I did the wrong thing and it became who I was for a year. I learned to hide."
      }
    ]
  },
  {
    "id": "p004",
    "name": "Mara",
    "bucket": "1990s/latin-america",
    "consent": "synthetic",
    "facts": [
      {
        "field": "name",
        "type": "facts",
        "value": "Mara"
      },
      {
        "field": "city",
        "type": "facts",
        "value": "Guadalajara"
      },
      {
        "field": "decade",
        "type": "facts",
        "value": "1990s"
      },
      {
        "field": "parent1",
        "type": "facts",
        "value": "provider"
      },
      {
        "field": "parent2",
        "type": "facts",
        "value": "storm"
      },
      {
        "field": "school",
        "type": "facts",
        "value": "elite"
      },
      {
        "field": "event1",
        "type": "facts",
        "value": "first-no"
      },
      {
        "field": "event2",
        "type": "facts",
        "value": "win"
      },
      {
        "field": "event3",
        "type": "facts",
        "value": "rupture"
      },
      {
        "field": "event4",
        "type": "facts",
        "value": "none"
      },
      {
        "field": "comfort",
        "type": "preferences",
        "value": "the refusal"
      },
      {
        "field": "way_of_loving",
        "type": "preferences",
        "value": "in the calm between weathers"
      },
      {
        "field": "core_fear",
        "type": "fears",
        "value": "being provided for but not seen"
      },
      {
        "field": "social_fear",
        "type": "fears",
        "value": "being found out"
      },
      {
        "field": "under_stress",
        "type": "stress",
        "value": "gets organized and goes quiet"
      },
      {
        "field": "under_conflict",
        "type": "stress",
        "value": "goes silent and watchful"
      },
      {
        "field": "fragment_1",
        "type": "fragments",
        "value": "Present through rules, money, and silence. Love was structure. I learned that being provided for and being seen are different things."
      },
      {
        "field": "fragment_2",
        "type": "fragments",
        "value": "Everyone's parent was someone. I learned what money sounds like when it is quiet."
      },
      {
        "field": "fragment_3",
        "type": "fragments",
        "value": "I refused something everyone expected. It cost I and it made I."
      },
      {
        "field": "fragment_4",
        "type": "fragments",